{
  "$schema": "http://json-schema.org/draft-07/schema#",
  "$id": "https://codegraphy.dev/schemas/codegraphy.schema.json",
  "title": "CodeGraphy Plugin Manifest",
  "description": "Schema for codegraphy.json plugin manifest files",
  "type": "object",
  "required": ["id", "name", "version", "apiVersion", "supportedExtensions"],
  "additionalProperties": false,
  "properties": {
    "$schema": {
      "type": "string",
      "description": "Path or URL to the JSON schema for validation"
    },
    "id": {
      "type": "string",
      "description": "Unique plugin identifier (e.g. codegraphy.typescript)"
    },
    "name": {
      "type": "string",
      "description": "Human-readable plugin name"
    },
    "version": {
      "type": "string",
      "description": "Semver version of the plugin"
    },
    "apiVersion": {
      "type": "string",
      "description": "Semver range of the CodeGraphy API this plugin is compatible with"
    },
    "supportedExtensions": {
      "type": "array",
      "items": { "type": "string" },
      "description": "File extensions this plugin handles (e.g. [\".ts\", \".tsx\"])"
    },
    "sources": {
      "type": "array",
      "items": {
        "type": "object",
        "required": ["id", "name", "description"],
        "additionalProperties": false,
        "properties": {
          "id": {
            "type": "string",
            "description": "Unique rule identifier"
          },
          "name": {
            "type": "string",
            "description": "Human-readable rule name"
          },
          "description": {
            "type": "string",
            "description": "Short description of what the rule detects"
          }
        }
      },
      "description": "Connection sources provided by this plugin"
    },
    "fileColors": {
      "type": "object",
      "additionalProperties": {
        "oneOf": [
          { "type": "string" },
          {
            "type": "object",
            "required": ["color"],
            "additionalProperties": false,
            "properties": {
              "color": { "type": "string" },
              "shape2D": { "type": "string", "enum": ["circle", "square", "diamond", "triangle", "hexagon", "star"] },
              "shape3D": { "type": "string", "enum": ["sphere", "cube", "octahedron", "cone", "dodecahedron", "icosahedron"] },
              "imagePath": { "type": "string", "description": "Relative path from plugin root to image file" }
            }
          }
        ]
      },
      "description": "Mapping of file extensions or filenames to color strings or shape/imagePath objects"
    },
    "defaultFilters": {
      "type": "array",
      "items": { "type": "string" },
      "description": "Glob patterns to exclude from file discovery by default"
    }
  }
}
