{
  "$schema": "../../codegraphy.schema.json",
  "id": "codegraphy.gdscript",
  "name": "GDScript (Godot)",
  "version": "1.0.0",
  "apiVersion": "^2.0.0",
  "supportedExtensions": [
    ".gd",
    ".godot",
    ".tscn",
    ".tres"
  ],
  "defaultFilters": [
    "**/.godot/**",
    "**/.import/**",
    "**/*.import",
    "**/.mono/**",
    "**/addons/**",
    "**/*.uid"
  ],
  "sources": [
    {
      "id": "preload",
      "name": "Preload",
      "description": "preload(\"res://...\")"
    },
    {
      "id": "load",
      "name": "Load",
      "description": "load(), ResourceLoader.load()"
    },
    {
      "id": "extends",
      "name": "Extends",
      "description": "extends \"res://...\" or ClassName"
    },
    {
      "id": "class-name-usage",
      "name": "Class Name Usage",
      "description": "Type annotations, static calls"
    },
    {
      "id": "ext-resource",
      "name": "External Resource",
      "description": "[ext_resource ... path=\"res://...\"] in .tscn and .tres files"
    },
    {
      "id": "project-settings",
      "name": "Project Settings",
      "description": "Resource-bearing settings in project.godot"
    }
  ]
}
