{
  "$schema": "../../codegraphy.schema.json",
  "id": "codegraphy.markdown",
  "name": "Markdown",
  "version": "1.0.0",
  "apiVersion": "^2.0.0",
  "supportedExtensions": [
    "*"
  ],
  "defaultFilters": [],
  "fileColors": {},
  "sources": [
    {
      "id": "wikilink",
      "name": "Wikilinks",
      "description": "[[Note Name]], ![[embed]]"
    }
  ]
}
